{
  "user": {
    "id": "u_fixture",
    "name": "Campsite",
    "email": "reader@example.test",
    "avatarUrl": null
  },
  "workspaceId": "ws_fixture",
  "plan": "free",
  "usage": {
    "channels": {
      "used": 0,
      "max": 1
    },
    "runsToday": {
      "used": 0,
      "max": 3
    }
  },
  "model": {
    "connected": false
  },
  "nextUpdateAt": null
}
